{
  "$schema": "https://raw.githubusercontent.com/cdrobayna/jsonresume-tools/main/packages/tailor/tailor-variant.schema.json",
  "name": "backend",
  "description": "Backend-focused roles: APIs, services, and the data layer.",
  "tag": "backend",
  "also": ["core"],
  "sections": { "drop": ["awards"] }
}
